{
  "run_id": "0353333e-3b95-4947-adb0-a34d60aaa4dc",
  "repo_root": "C:\\Users\\MeMyself\\mergetonic\\merge-tonic-lib\\merge-tonic-lib\\tests\\_tmp_cli\\hydrate_runtime_local",
  "persist_root": "C:\\Users\\MeMyself\\mergetonic\\merge-tonic-lib\\merge-tonic-lib\\tests\\_tmp_cli\\hydrate_runtime_local\\.tonic\\chroma_db",
  "vector_backend": "memory",
  "stages": [
    {
      "stage_id": "config.resolve",
      "status": "completed",
      "content_hash": "810988979af7189f0ad9a278e93739a18208d2c1d54c26fd9607e81fab3fb0e7",
      "started_at": "2026-03-29T15:57:09.742950+00:00",
      "finished_at": "2026-03-29T15:57:09.749069+00:00",
      "error": ""
    },
    {
      "stage_id": "branch_intents.collect",
      "status": "completed",
      "content_hash": "b1c6a9868b2040100bf90964b3ef0fb2fa09ef8aa1f4c139958659a2d086041f",
      "started_at": "",
      "finished_at": "2026-03-29T15:57:09.751979+00:00",
      "error": ""
    },
    {
      "stage_id": "index.sync",
      "status": "completed",
      "content_hash": "2badfa4cfdc510daedb07ad51cdd26af48b307d3142c543bf814701577845996",
      "started_at": "2026-03-29T15:57:09.755713+00:00",
      "finished_at": "2026-03-29T15:57:09.838972+00:00",
      "error": ""
    },
    {
      "stage_id": "question_plan.compose",
      "status": "completed",
      "content_hash": "ffd95ca7d17e1e90d1a5063c695a1ba093571b9de1e7eba76971f155e374cf1b",
      "started_at": "",
      "finished_at": "2026-03-29T15:57:09.754790+00:00",
      "error": ""
    },
    {
      "stage_id": "hydrate.cycle",
      "status": "completed",
      "content_hash": "3e622de71161aaad237e2c02b51bbdf39a72769035766fc5c10350197ce787d7",
      "started_at": "2026-03-29T15:57:09.840266+00:00",
      "finished_at": "2026-03-29T15:57:10.187288+00:00",
      "error": ""
    },
    {
      "stage_id": "code_walk.run",
      "status": "completed",
      "content_hash": "1ee24f50d6fed8bffcb7668775c950fe66d3e4d270e81c3342076e2593077a57",
      "started_at": "",
      "finished_at": "2026-03-29T15:57:10.184530+00:00",
      "error": ""
    },
    {
      "stage_id": "retrieval.merge",
      "status": "completed",
      "content_hash": "0dcc85aa0706959258068ed70ae5bae821677da1609b1390dcaf7e457923784a",
      "started_at": "",
      "finished_at": "2026-03-29T15:57:10.187360+00:00",
      "error": ""
    },
    {
      "stage_id": "llm.transcript",
      "status": "completed",
      "content_hash": "",
      "started_at": "",
      "finished_at": "2026-03-29T15:57:10.189212+00:00",
      "error": ""
    },
    {
      "stage_id": "metadata.hydrate",
      "status": "completed",
      "content_hash": "d2201fee6b7a29b76d6d09126a13c4f1f5abfc11fd20ad09f7c0eaaa36172d8e",
      "started_at": "",
      "finished_at": "2026-03-29T15:57:10.189196+00:00",
      "error": ""
    },
    {
      "stage_id": "emit",
      "status": "completed",
      "content_hash": "5aaa56eea53bf25dab79d248a8931a921706b4790ac80c0ac6999a2c04d20773",
      "started_at": "",
      "finished_at": "2026-03-29T15:57:10.192055+00:00",
      "error": ""
    }
  ],
  "artifacts": {
    "index_state_path": "C:\\Users\\MeMyself\\mergetonic\\merge-tonic-lib\\merge-tonic-lib\\tests\\_tmp_cli\\hydrate_runtime_local\\.tonic\\chroma_db\\index-state.json",
    "run_state_path": "C:\\Users\\MeMyself\\mergetonic\\merge-tonic-lib\\merge-tonic-lib\\tests\\_tmp_cli\\hydrate_runtime_local\\.tonic\\hydration-runs\\0353333e-3b95-4947-adb0-a34d60aaa4dc\\run-state.json",
    "branch_intents_path": "C:\\Users\\MeMyself\\mergetonic\\merge-tonic-lib\\merge-tonic-lib\\tests\\_tmp_cli\\hydrate_runtime_local\\.tonic\\hydration-runs\\0353333e-3b95-4947-adb0-a34d60aaa4dc\\branch-intents.json",
    "question_plan_path": "C:\\Users\\MeMyself\\mergetonic\\merge-tonic-lib\\merge-tonic-lib\\tests\\_tmp_cli\\hydrate_runtime_local\\.tonic\\hydration-runs\\0353333e-3b95-4947-adb0-a34d60aaa4dc\\question-plan.json",
    "hydration_cycle_path": "C:\\Users\\MeMyself\\mergetonic\\merge-tonic-lib\\merge-tonic-lib\\tests\\_tmp_cli\\hydrate_runtime_local\\.tonic\\hydration-runs\\0353333e-3b95-4947-adb0-a34d60aaa4dc\\hydration-cycle.json",
    "retrieval_path": "C:\\Users\\MeMyself\\mergetonic\\merge-tonic-lib\\merge-tonic-lib\\tests\\_tmp_cli\\hydrate_runtime_local\\.tonic\\hydration-runs\\0353333e-3b95-4947-adb0-a34d60aaa4dc\\retrieval.json",
    "retrieval_merge_path": "C:\\Users\\MeMyself\\mergetonic\\merge-tonic-lib\\merge-tonic-lib\\tests\\_tmp_cli\\hydrate_runtime_local\\.tonic\\hydration-runs\\0353333e-3b95-4947-adb0-a34d60aaa4dc\\retrieval-merge.json",
    "hydration_result_path": "C:\\Users\\MeMyself\\mergetonic\\merge-tonic-lib\\merge-tonic-lib\\tests\\_tmp_cli\\hydrate_runtime_local\\.tonic\\hydration-runs\\0353333e-3b95-4947-adb0-a34d60aaa4dc\\hydration-result.json",
    "llm_transcript_path": "C:\\Users\\MeMyself\\mergetonic\\merge-tonic-lib\\merge-tonic-lib\\tests\\_tmp_cli\\hydrate_runtime_local\\.tonic\\hydration-runs\\0353333e-3b95-4947-adb0-a34d60aaa4dc\\llm.jsonl"
  },
  "run_status": "completed",
  "pipeline_version": "1",
  "schema": "tonic-hydration-pipeline"
}
